<?xml version="1.0" encoding="UTF-8"?>
<xsd:schema xmlns:xsd="http://www.w3.org/2001/XMLSchema" xmlns:od="urn:schemas-microsoft-com:officedata">
<xsd:element name="dataroot">
<xsd:complexType>
<xsd:sequence>
<xsd:element ref="battle_entities" minOccurs="0" maxOccurs="unbounded"/>
</xsd:sequence>
<xsd:attribute name="generated" type="xsd:dateTime"/>
</xsd:complexType>
</xsd:element>
<xsd:element name="battle_entities">
<xsd:annotation>
<xsd:appinfo/>
</xsd:annotation>
<xsd:complexType>
<xsd:sequence>
<xsd:element name="key" minOccurs="1" od:jetType="text" od:sqlSType="nvarchar" od:nonNullable="yes">
<xsd:simpleType>
<xsd:restriction base="xsd:string">
<xsd:maxLength value="50"/>
</xsd:restriction>
</xsd:simpleType>
</xsd:element>
<xsd:element name="class_validation" minOccurs="1" od:jetType="text" od:sqlSType="nvarchar" od:nonNullable="yes">
<xsd:simpleType>
<xsd:restriction base="xsd:string">
<xsd:maxLength value="50"/>
</xsd:restriction>
</xsd:simpleType>
</xsd:element>
<xsd:element name="type" minOccurs="0" od:jetType="text" od:sqlSType="nvarchar">
<xsd:simpleType>
<xsd:restriction base="xsd:string">
<xsd:maxLength value="50"/>
</xsd:restriction>
</xsd:simpleType>
</xsd:element>
<xsd:element name="walk_speed" minOccurs="1" od:jetType="single" od:sqlSType="real" od:nonNullable="yes" type="xsd:float"/>
<xsd:element name="run_speed" minOccurs="1" od:jetType="single" od:sqlSType="real" od:nonNullable="yes" type="xsd:float"/>
<xsd:element name="acceleration" minOccurs="1" od:jetType="single" od:sqlSType="real" od:nonNullable="yes" type="xsd:float"/>
<xsd:element name="deceleration" minOccurs="1" od:jetType="single" od:sqlSType="real" od:nonNullable="yes" type="xsd:float"/>
<xsd:element name="charge_speed" minOccurs="1" od:jetType="single" od:sqlSType="real" od:nonNullable="yes" type="xsd:float"/>
<xsd:element name="crawl_speed" minOccurs="1" od:jetType="single" od:sqlSType="real" od:nonNullable="yes" type="xsd:float"/>
<xsd:element name="charge_distance_commence_run" minOccurs="1" od:jetType="single" od:sqlSType="real" od:nonNullable="yes" type="xsd:float"/>
<xsd:element name="charge_distance_adopt_charge_pose" minOccurs="1" od:jetType="single" od:sqlSType="real" od:nonNullable="yes" type="xsd:float"/>
<xsd:element name="charge_distance_pick_target" minOccurs="1" od:jetType="single" od:sqlSType="real" od:nonNullable="yes" type="xsd:float"/>
<xsd:element name="radius" minOccurs="1" od:jetType="single" od:sqlSType="real" od:nonNullable="yes" type="xsd:float"/>
<xsd:element name="shape" minOccurs="1" od:jetType="text" od:sqlSType="nvarchar" od:nonNullable="yes">
<xsd:simpleType>
<xsd:restriction base="xsd:string">
<xsd:maxLength value="50"/>
</xsd:restriction>
</xsd:simpleType>
</xsd:element>
<xsd:element name="radii_ratio" minOccurs="1" od:jetType="single" od:sqlSType="real" od:nonNullable="yes" type="xsd:float"/>
<xsd:element name="mass" minOccurs="1" od:jetType="single" od:sqlSType="real" od:nonNullable="yes" type="xsd:float"/>
<xsd:element name="height" minOccurs="1" od:jetType="single" od:sqlSType="real" od:nonNullable="yes" type="xsd:float"/>
<xsd:element name="fire_arc_close" minOccurs="0" od:jetType="longinteger" od:sqlSType="int" type="xsd:int"/>
<xsd:element name="fire_arc_loose" minOccurs="0" od:jetType="longinteger" od:sqlSType="int" type="xsd:int"/>
<xsd:element name="turn_speed" minOccurs="0" od:jetType="longinteger" od:sqlSType="int" type="xsd:int"/>
<xsd:element name="hit_points" minOccurs="1" od:jetType="longinteger" od:sqlSType="int" od:nonNullable="yes" type="xsd:int"/>
<xsd:element name="s_ColLineage" minOccurs="0" od:jetType="oleobject" od:sqlSType="image">
<xsd:simpleType>
<xsd:restriction base="xsd:base64Binary">
<xsd:maxLength value="1476395008"/>
</xsd:restriction>
</xsd:simpleType>
</xsd:element>
<xsd:element name="s_Generation" minOccurs="0" od:jetType="longinteger" od:sqlSType="int" type="xsd:int"/>
<xsd:element name="s_GUID" minOccurs="0" od:jetType="replicationid" od:sqlSType="uniqueidentifier" od:autoUnique="yes">
<xsd:simpleType>
<xsd:restriction base="xsd:string">
<xsd:maxLength value="38"/>
</xsd:restriction>
</xsd:simpleType>
</xsd:element>
<xsd:element name="s_Lineage" minOccurs="0" od:jetType="oleobject" od:sqlSType="image">
<xsd:simpleType>
<xsd:restriction base="xsd:base64Binary">
<xsd:maxLength value="1476395008"/>
</xsd:restriction>
</xsd:simpleType>
</xsd:element>
</xsd:sequence>
</xsd:complexType>
</xsd:element>
</xsd:schema>
